<?xml version="1.0"?>
<!DOCTYPE dc_configuration SYSTEM "dcconfig.dtd">

<!--     
         Analyze branch/near return prediction using event-based profiling
         Date:    11 June 2007
         Version: 1.1c
         Processor: AMD K7 family
         Copyright (c) 2007 Advanced Micro Devices, Inc. All rights reserved.
 -->

<dc_configuration cpu_type="i386/athlon">

  <ebp name="Investigate branching" mux_period="1">

      <event select="C0" mask="00" os="T" user="T" count="250000"></event>
      <event select="C2" mask="00" os="T" user="T" count="25000"></event>
      <event select="C3" mask="00" os="T" user="T" count="25000"></event>
      <event select="C4" mask="00" os="T" user="T" count="25000"></event>

    <tool_tip>
      Find mispredicted branches
    </tool_tip>

    <description>
      Use this configuration to find poorly predicted branches.
    </description>

  </ebp>

</dc_configuration>
