<?xml version="1.0"?>
<!DOCTYPE dc_configuration SYSTEM "dcconfig.dtd">

<!--     
         Instruction-based sampling (IBS) data collection configuration
         Date:    November 20th 2009
         Version: 1.1
         Processor: AMD family 10h
         Copyright (c) 2007 Advanced Micro Devices, Inc. All rights reserved.
 -->

<dc_configuration cpu_type="x86-64/family10">

  <ebp name="IBS Op Northbridge Services" mux_period="0">

	<event select="F201" mask="01" count="1000000"></event>
	<event select="F242" mask="01" count="1000000"></event>
	<event select="F243" mask="01" count="1000000"></event>
	<event select="F244" mask="01" count="1000000"></event>
	<event select="F245" mask="01" count="1000000"></event>
	<event select="F246" mask="01" count="1000000"></event>
	<event select="F247" mask="01" count="1000000"></event>
	<event select="F248" mask="01" count="1000000"></event>

    <tool_tip>
      Measure northbridge services performance using IBS Op
    </tool_tip>

    <description>
      Use this configuration to measure northbridge services performance 
      using IBS Op.
    </description>

  </ebp>

</dc_configuration>
