<?xml version="1.0"?>
<!DOCTYPE dc_configuration SYSTEM "dcconfig.dtd">

<!--     
         Instruction-based sampling (IBS) data collection configuration
         Date:    November 20th 2009
         Version: 1.1
         Processor: AMD family 10h
         Copyright (c) 2007 Advanced Micro Devices, Inc. All rights reserved.
 -->

<dc_configuration cpu_type="x86-64/family10">

  <ebp name="IBS Op Branch" mux_period="0">

	<event select="F100" mask="01" count="1000000"></event>
	<event select="F101" mask="01" count="1000000"></event>
	<event select="F102" mask="01" count="1000000"></event>
	<event select="F103" mask="01" count="1000000"></event>
	<event select="F104" mask="01" count="1000000"></event>
	<event select="F105" mask="01" count="1000000"></event>
	<event select="F106" mask="01" count="1000000"></event>

    <tool_tip>
      Find mispredicted branches using IBS Op
    </tool_tip>

    <description>
      Use this configuration to find poorly predicted branches
      using IBS Op.
    </description>

  </ebp>

</dc_configuration>
