<?xml version="1.0"?>
<!DOCTYPE dc_configuration SYSTEM "dcconfig.dtd">

<!--     
         Instruction-based sampling (IBS) data collection configuration
         Date:    November 20th 2009
         Version: 1.0
         Processor: AMD family14h
         Copyright (c) 2009 Advanced Micro Devices, Inc. All rights reserved.
 -->

<dc_configuration cpu_type="x86-64/family14h">

  <ebp name="IBS Op Load-Store Memory Access" mux_period="0">

	<event select="F200" mask="01" count="1000000"></event>
	<event select="F201" mask="01" count="1000000"></event>
	<event select="F202" mask="01" count="1000000"></event>
	<event select="F20D" mask="01" count="1000000"></event>
	<event select="F20E" mask="01" count="1000000"></event>
	<event select="F20F" mask="01" count="1000000"></event>

    <tool_tip>
      Measure data load / store memory access performance using IBS Op
    </tool_tip>

    <description>
      Use this configuration to measure data load / store memory access 
      performance using IBS Op.
    </description>

  </ebp>

</dc_configuration>
