<?xml version="1.0"?>
<!DOCTYPE dc_configuration SYSTEM "dcconfig.dtd">

<!--     
        Analyze instruction fetch and ITLB behavior using event-based profiling
        Date:    20 February 2008
        Version: 1.2
        Processor: AMD family 11h
        Copyright (c) 2008 Advanced Micro Devices, Inc. All rights reserved.
 -->

<dc_configuration cpu_type="x86-64/family11h">

  <ebp name="Investigate instruction access" mux_period="1">

      <event select="C0" mask="00" os="T" user="T" count="250000"></event>
      <event select="80" mask="00" os="T" user="T" count="250000"></event>
      <event select="81" mask="00" os="T" user="T" count="25000"></event>
      <event select="84" mask="00" os="T" user="T" count="25000"></event>
      <event select="85" mask="00" os="T" user="T" count="25000"></event>

    <tool_tip>
      Analyze fetch and ITLB behavior
    </tool_tip>

    <description>
      Use this configuration to find instruction fetches with poor
      L1 instruction cache locality and poor ITLB behavior.
    </description>

  </ebp>

</dc_configuration>
